Post_ID,Post,Comment,Score
4biemc,Basically it goes like this.  Somebody posts a one-sentence thing.  Then the next post sees if they can make it dirty.  Etc etc.  Imaginary free internet points go to the winner.   I'll start. ,"[Today, our commenters were pretty cool guys](http://imgur.com/HcR1Opd)",16629
4r1sqx,"She claims she thought her stuff was ""too girly"". On the one hand I appreciate the heroic sacrifice of a couple of square inches of shelf space in her bathroom, but on the other I can't help wondering if there are any other cannibalism red flags I should be looking out for... Edit: /u/MisterKanister is a generous bastard. I'll go and hide in /r/lounge until after dinner. Edit the Second: c'mon mods, I'm a rare OP if anything","Read the bottle - if it says ""shower gel"" or ""body scrub"" or the like, you're fine. If it says ""marinade"", ""preheat the oven"", ""tenderise before cooking"", or ""best paired with shiraz"", I'd be replacing the metal cutlery with plastic sporks. Also, if she wants to ""go Dutch"" on a date, may be worth clarifying if she means she wants to pay for her own meal, or if she has a backpacker from Amsterdam defrosting in the bathtub.",6458
5bvh8n,"Thanks, and have a good day.",[The mods' feelings about any posts/comments regarding the election](https://m.youtube.com/watch?v=H5CSBZz3eOI),5744
6a0lns,"Kidding. Relax. It's next Sunday, don't forget. ",HAHAHA PSYCH YOU TOTALLY GOT US ALL OP YOU'RE SUCH A FUNNY DUDE,1875
6kfzpq,"Background story: I've been dating my current girlfriend for almost a year. In fact, we are celebrating our anniversary next month. She's a wonderful person who has been nothing but fully supportive of whatever I do. I've started a low carb diet and lost around 40 pounds in 6 months. While everyone was criticizing it (oh you need carbs, this is unhealthy, blah blah blah), she was there for me through and through. In fact, she got on the same diet and lost 5 pounds just so we both have the same routine and plan. Throughout my weight loss journey, she'd always compliment me and make me feel better about myself (I kind of had some self-esteem issues). I've reached my weight goal a few weeks ago and I'm over the moon. I've been hitting the gym to gain muscle, joined and completed marathons, but the most surprising out of all was the attention I've been getting from women. Something that never happened before.  So last night, I was out with a few friends without the gf. She claimed to have a headache, but I'm pretty sure she's planning our anniversary (she loves planning stuff). I get to the bar, and there were a bunch of people that I haven't seen since highschool 10 years ago. One of which was a cute girl I remember from back then. I was chatting with her throughout the whole night. She was so amused by my weight loss and she told me how she wants to become a nutritionist and help people out. We had so much in common that made me lose track of how much I drank. Since I'm on low carb, alcohol gets me drunk so much faster. Everyone gets drunk also and decides to head back to the girls place. I, on the other hand, was completely wasted so I can't remember most of what happened. I woke up in the morning with one hell of a hangover, and my friend filled me up with all the events from last night. I was mortified. Apparently, they all got pizza and I ate a whole meat cravers pan crust with extra cheese pizza all by myself. I can already see the disappointment in my gfs face.  What's your cheat story?","The moral of the story is: Work up an appetite wherever you want, but eat at home. ",25849
8kodk5,I mean in a non-masturbatory way. It’s just comfy to have your hand on your junk. Righty?,"Show her this post OP, SHOW HER AND LAUGH",10007
9o6wkt,"I miss him already. I'm not crying, you're crying","I was at a low point in life after I lost my job and my car broke down. That summer a little red finch perched himself outside my window every morning and would sing. I called him Charles and He helped me get up in the morning and face the day. I would wake up, wish him a good morning, have a cup of coffee with him and then get about my day. About a month later I saw this little gal finch start showing up nearby when he would sing in the morning. Bro had moves. About a week later they stopped showing up. Get it Charles. Hope you had a good life Edit: I'm glad you all enjoyed the story :) I never knew it was a story I had that I could share before. I figured I could share Charles a bit more with you. Presenting, Charles the finch.  https://imgur.com/gallery/uEppO10",9346
9r7aqp,"This is more for those who built their own wealth instead of those who were born into it. I’m wondering as your wealth grew, or you became ‘rich’, what changes occurred that you did not expect? EDIT: I’m getting a lot of “what about wealthy women?”  questions. I just want to say, I am asking males because I’m a male myself so I feel their experiences to be more relatable, this is the r/askmen sub and you are very free to ask women the same question on the r/askwomen sub. No sexist intentions, just find males more relatable in this context. ","Things haven’t changed much for me. Neither friends nor family hit me up for money. I dress like a slob. I only work when I want to but that has gotten me complacent. Women don’t throw themselves at me nor do I think they’re after my money. I travel a lot. I almost never cook for myself. I default to ordering in or picking up fast food. I love fancy restaurants. I still struggle to spend money on some things. And yet on other things, I’ll drop thousands of dollars without blinking.  The biggest change for me has been motivation. I used to love working and now I’m struggling to be excited about anything.  The biggest challenge is teaching my kids how to be self-sufficient. I had house cleaners and cancelled the service. We do our own house chores. I do my own yard work. I still want them to have pride in ownership and recognize that there isn’t a magical money tree. ",17889
9s5dgt,"My girlfriend is super, super capable, and can do anything she puts her mind to.  She's hyper-organized, and can manage complex tasks and projects without writing anything down.  Why she's with my disorganized, ADHD ass is a complete fucking mystery. But whenever she loads the dishwasher, it's like a drunken toddler did it.  Spoons and bowls nested, things placed in the racks crosswise or in racks that are way too tight for them, dishes put into the racks in random sequence rather than with like dishes, glasses put in sideways, bowls balanced precariously such that they'll tip up and catch all the dirty water, etc, etc, etc.  It's never the same way twice, either.  Every time she does it, she tempts me in new and different ways to scream ***""WHY?!?""*** into the sink. EDIT: And so, we commit my inbox to the deep, in the sure and certain hope that the sea will one day give back all the time I've wasted on the internet.  Amen.","She is clumsy until she simply reacts. Like, if I throw a ball to her by surprise, 99% of the time she'll catch it. But if she knows it's coming, she drops it. ",9977
9vmibe,"I was at my local gym this morning, and saw a cute girl using the squat machine. I took a few glances while in between sets, and caught eye contact a few times, so figured I'd say something the next time I walked past her. As I finished a set and went to get some water, I walked by her and saw her smile at me. It literally broke my brain and I forgot how to function. I made some weird audible noise and froze before turning around. I couldn't help but laugh at myself as I walked away, but Jesus, her smile was enchanting! Has a woman ever broken your brain from her physical appearance alone? &nbsp; **Update:** Wow! I didn't expect this to get so popular. It's heartwarming to know I'm not the only guy to embarrass himself in front of a pretty woman. I really appreciate all of the awesome stories you've all shared! Hopefully the next time I run into squat girl, I'll be able to properly introduce myself.  **Update 2:** Thanks for the Silver, kind stranger! **Final Update:** Thank you all so much for sharing these wonderful stories. You've all given me enough to read over and smile at for months to come. ","Yep.  New Years Eve last year me and my friends went to Nashville.  We were sitting at a table in a bar.  This girl walked up to the bar and she was the prettiest girl I've ever seen.  I normally don't approach women, but I would have beaten myself up if I didn't try.  I'm not the smoothest guy.  I'm a big ball of anxiety and introverted.  I walked up to her and said ""INCOMPREHENSIBLESOUND*""  "" HOLY SHIT! WHAT THE FUCK WAS THAT BRAIN?!? FUCK YOU BRO"" I thought.  She just looked at me and said ""What?"" I said ""INCOHERENTMUMBLE*""  I almost just walked back to the table.  I couldn't help but grin and cringe a bit, because I was fucking it up this badly.  Then I finally said something coherent.  ""Uhhh, my bad about that I uhhh don't really do this much, but clearly I'm at a loss.  I was wondering if I could buy you a drink and get to know you a little bit?""   She said ""I'm actually here with my friends and I should get back to them.""     I went back to the table and told my friends what happened.  I proceeded to get roasted the rest of the trip.  But damn my noggin broke on that one.",8708
9xb11g,"Never had anyone to teach me these things, so looking for Reddit guidance.  Thank ","Look at the bolts that connect the panels to the vehicle. They come painted the same color as the car from the factory. If the paint is chipping, or it looks like there's been a wrench on them, that could indicate that bodywork was done on the car and the panel has either been readjusted or replaced. Make sure the VIN behind the windshield matched the VIN on at least one other panel (ex: driver door) and also the title. Look for rust that is perforated on either the body or frame of the car. As others have said: tire condition, tire brands, and mismatched tires will give you a good indication of previous ownership. Pull the oil cap and look inside with a flashlight. Look for sludge or coolant mix. Basically make sure the oil looks clean and smooth. Red flags would be a metal shavings or a frothy or chocolate milkshake appearance. Crank up the car, open the hood, and just take a few moments to listed to the engine. Some sounds are normal, but listen for loud tapping or clunking sounds. When you test drive the car, keep the radio off. If you can, keep the ac/heat off as well (test them separately). Drive the car both carefully and aggressively to put it under different loads. If its an automatic transmission, listen and feel carefully for slipping or jumping of gears. And watch the tachometer for over revving. If it's a manual, listen and feel for grinding, or getting stuck/popping out of gear. During you test drive, make sure the odometer turns at least one full mile. Watch for smoke when accelerating. Bluish smoke indicates that the car is burning oil through the exhaust, and dark/black smoke indicates serious major engine problems. \*EDIT: Black smoke will be normal on some diesel vehicles. If possible, always test drive the car with the engine cold. There are some mechanical issues that ""go away"" after the engine and transmission are warmed up. Some sellers know this and will warm the car up before showing it. There are a lot more tips and resources out there. I would recommend going on YouTube and checking out a channel called ChrisFix. He has posted a series of videos on buying used cars and has a checklist you can download. Not all of the information is perfect, but it is really helpful for beginners. Source: I was a buyer for major auto dealership for 3 years. &#x200B; EDIT\* One more thing to add, download the ""myCARFAX"" app. It's free, and you can scan the VIN and it will show you all of the *reported* maintenance and repairs on the vehicle. ",5157
9xlxw6,I sat in the wrong spot on the couch.  Was just wondering if anyone else started their day off on the wrong foot!,shot her fork out of her hand with a nerf gun while she ate breakfast,19932
a7kmvc,"For instance, I was just doing some manscaping. I had a guard on a set of trimmers, for safety. And somehow managed to stab/tear my nutsack open anyway. Fear not, tis only a flesh wound. Not enough to warrant calling for help but just enough to make me sit there pinching my ballskin for 45 minutes, reflecting on exactly the level of fucktardery I just performed. What's your story? -Edit- For some reason (I'm gonna claim blood loss), I used my alternate account to post this and not my main. And it is way more successful than any of my other posts ever were.. Fml.","I was on a Skype for Business conference call at work, and was on mute. I let loose a glorious fart, further enhanced by the acoustics of spandex underwear and a wooden chair. I was not on mute. Furthermore, because no one else was talking, it showed me as the active speaker and my picture for the next 5-10 seconds so everyone knew.",14623
a9yuoy,Meaning you were expecting something different based on how she looked clothed.,"One time. It wasn't so much as how she looked, but the odor that came from her once she was completely naked. I couldn't do it and had to trash my bad sheets.",19177
ab5oww,And do you find it easy to do so?,"Like... once, to my best friend of many years, before we went off to college. Mostly my friends and I just... you know... do something, then someone mumbles something like ""I’m feeling kinda down since Linda left,"" then someone else gives him a pat on the back and mumbles something about knowing it can be rough, then we all mumble ""yup"" and go about what we were doing. ",19012
abtb84,"E.g. fetishes, racial or ethnic stereotypes, etc...","I'm latino. Some of the girls i dated used to ask me to speak Spanish in bed. My Spanish is terrible and the bits i know are from my grandmother or school. I definitely don't know dirty talk.  I also get comments about dancing. Women think I'm an expert tango and salsa dancer. I had to learn the basics of both because it was requested so much. I can cook but it gets listed as a racial trait instead of it being my own skill. Any time i express interest in something or show skill, i hear, ""you latinos are always so passionate."" ",12259
ac4v8i,"Eg for a person who has an urge to punch walls and things Edit: Thanks for all the suggestions, I'm really grateful for them all! I'll be sure to pass them on to my boyfriend.     Thank you all so so much for the suggestions, this really blew up. Might just have to send him this thread haha EDIT: Thank you so much for the gold, I really wasn't expecting it and I'm really grateful!! ","While not everyone has the mean to do so; chopping wood is the best outlet I’ve found. You get to exert force, destroy something, and create a useful resource all at the same time.  Edit: I posted this before  going to bed this morning, coming off of a 12 hour night shift.  I had no idea so many people would relate. Over 7,000 upvotes? What a thing to wake up to.   Men’s mental heath is a pretty important issue that doesn’t seem to get much attention. I’m glad to see all of you taking care of yourselves.",12922
acgtkx,"Since my teenage years I remember having a bitter attitude towards my birthdays because they signified another year of my life had passed. Now as a 23 year old guy this feeling of time fleeting has only grown stronger as every person I talk to in their 40’s, 50’s etc always has the same remark: “it feels like just yesterday I was your age”. I’ve been suffering from somewhat of a quarter life crisis outlined by nihilism, depression, and loneliness. While my therapist has definitely been helping as well as starting to meditate, I can’t seem to shake off that thought that all my progress and memories will eventually have a definitive end. These feeling are exasperated by my analytical, introspective, and logical nature. As a software engineer who relies on my thinking for my job, it’s hard for me to draw then line between which thoughts of mine are helpful and which are detrimental to my wellbeing. I want to just be like some of my friends who just live life and “do what feels good”, but it seems like I’ve been cursed to overthink things. Has anyone else dealt with similar struggles and if so what helped you?","You’re in a tough cycle because someone with your thought process will require a lot of work to change the way you think. The way that I cope with that idea is that I literally just just put myself out there to do what ever I can. I know I will die one day so I have to make the most of everything. Enjoy the family time, enjoy the time with friends, make a mistake but laugh at it, don’t dwell on it. If your job is stressful, try find a new one that isn’t as stressful, take time to eat well, enjoy watching TV, appreciate the little things because the little things mean a lot, don’t have huge expectations because they nearly always get knocked down. Try an make a memory with everything you do. There’s something’s I won’t do like go on theme park rides because they scare me, but I’m happy to know that if I die today that I haven’t missed out on that part of life because that never interests me. The fact that death is certain in life is something you just need to accept and instead of worrying about it, do the things you want and have as many memories as you can to the point you can say, “yeah, I’ve done enough”. Im 22, 23 in May, I try and make the most of all the little things, want nothing more than family time or going to the pub with my mates and that’s what keeps me happy and how I cope with the fact that I will die one day so let’s just enjoy the little things ",4642
acu5bu, ,I asked to go to the bathroom in an 80 person lecture.,26782
agk10d,In my case since I was obsessed with the military as a kid he would be shocked at the pacifist party guy I am now and would wonder why the fuck am I moving to Japan. He would also wonder why I'm not an officer in the navy. I would be pleased I was finally able to lose the weight and not be fat any more though. ,I'm married to the girl I was crushing on around that age.  That would probably stand out.  I think the biggest surprise would be that I am not working in a tech field of any kind.,18280
ahb78b,"Mine is: *Get home from work and lay down and make Jesus sad. Clear all the stress, can't have that little motherfucker making decisions *Go take a shower, stare at the mirror, and slowly realize that you are a worthless piece of shit, they said yes after all. *Fix hair, trim up. *Take a shot of Jameson, to calm the nerves and remind your self of bad decisions, and not to repeat them. *Get dressed, over think whether you over or underdress. Until you decide fuck it, and where that shirt that one girl complimented that one time. *Realize that you started to get ready to early and  the date isn't for the next few hours. And sit around and play videogames until time to leave. Alternatively: *Ask girl to meet you at bar, set a time.  Go there like you would any other time, and just hangout. Edit: People have strong opinions on whether or not to exercise the demon before going on a date. Edit2: After reading all the responses, can I request this post get a ""We're All Virgins"" flair. Edit3: I deserve that",Make sure my house is clean in case we end up back there afterwards.,11183
ajrsnf,"Edit: meant this: “Now that I am older, I understand that”.",That my dad took the long way when he'd take me back to my mom's so we'd have more time together. ,16604
akn21c,"I secretly when I'm in my room alone I do some knitting. It helps me with anxiety. Edit: keep doing what you guys like! That doesn't affect your masculinity!! Edit 2: some guys say they enjoy pedicure, so I did it and was absolutely amazing. MY FEET GLOWS NOW. I'll do it again in 2 weeks lmao Another edit: THANK YOU ANONYMOUS REDDITOR FOR THE SILVER! Another one: THANK YOU SOOO MUCH FOR THE SECOND SILVER, ANONYMOUS REDDITOR!! And another edit: THANK YOU FOR THE GOLD!!! AND THE PREMIUM!!! ANONYMOUS REDDITOR!!! I REALLY APPRECIATE IT!!! yes another edit: THANK YOU SOOOOOO MUCH FOR ANOTHER SILVER, ANONYMOUS REDDITOR!!!",I tried this sugar scrub shit once and every time I shower I think about my inferior bar of soap and it’s endless disappointment ,11407
am13za,"#Fuck all the things!!! ^^EDIT: ^^RIP ^^Inbox ^^EDIT2: ^^Thanks ^^for ^^the ^^gold, ^^kind ^^sir/madam. ^^EDIT3: ^^My ^^first ^^Platinum! ^^Thank ^^you! ^^EDIT4: ^^For ^^no ^^good ^^reason",One time i was home from school and my parents were at work so i put a ziplock bag in between the couch cushions with some lotion in it and went to town. ,10588
anac53,My gf is gone for the week. Tonight I started sauteing an onion for another meal. I loved the smell of the onion so much that I just ate sautéed onions.  Edit: y'all are some sick bastards. Keep up the good work!,So much garlic I’d have to be quarantined. ,6187
ap27l5,This has annoyed me to no end for the longest time.  Edit: just got back wtf happened,Pull them at the bottom right as you get out.  Enunciating is not the word you’re looking for btw,17652
aqj6qw,Just learned that my boyfriend goes for days without changing his underwear and I’m horrified. Is this a normal dude thing?  Edit: HOW is this my most upvoted post  anyway. Thanks for settling our little domestic dispute. Your opinion matters! Except for the bullies out there name calling. He is bae and I love him ❤️,how am I single.   *edit - STOP WITH THE GOLD YOU ASSHOLES,9994
ar3clt,I'm currently at 44 minutes outside of Sephora,Why don’t you go to a store you like and text each other when you’re done?,8095
as37p8,"Not asking for a friend. I never expected to ever have sex, let alone get someone on a date but It happened last week. Everything went well and the second time we met, we both went to her apartment to drink and watch a movie. After we kissed, I just noped the fuck out and cycled home because I couldn't handle the stress. When do I tell women this info, if at all?  Edit: Thanks for all these great replies, the gold and the accurate flair. ","You should tell her ASAP but when you do, own that shit. If you express this bluntly and with confidence you’ll have a much better chance.",6924
asp6lg,"Edit: wow, the love on this post is amazing. Just goes to show you there are endless ways of showing someone how much you mean to them :~)","My husband is wonderful, but not the most physically expressive person. He let's me kiss and snuggle him whenever I please, but doesn't actively seek out that kind of contact, which is fine. When we first started dating this bothered me a little, until one day.. It was the middle of winter (very very cold where I live) and my car ran out of wiper fluid. I was trying to replace it but I couldn't get the hood of my car open because it was jammed and my fingers were freezing. Frustrated and cold I went inside and took a nap, after venting to my bf. When I woke up I found out that during my nap he had driven 30 minutes across the city, fixed my hood, replaced the wiper fluid, and gone back home. That was the day I realized that love can be shown in many different ways.  Edit: We have looked into the 5 love languages! Thanks for all the suggestions to do so ",9175
