Post_ID,Post,Comment,Score
gbkcu8,"EDIT: Holy shit..!!!! This blew up!!! Thank you so much guys! I will try to go through comments and will try to respond as much as I can. Thanks a lot again for your help.. Also thank you for the gold!! EDIT 2: I had no idea that I might’ve anxiety and lot of people are going through the same thing. I learned a lot from this thread and I already started checking my options for therapy/counseling. I also received lots of messages from people who are willing to help and I genuinely appreciate it. Thank you again everyone and thank you for cool awards! EDIT 3 (almost 5 months after posting this): I started exercising and that gave me a little more self confidence to stand-up for myself. I also forced myself to communicate with my bosses on topics apart from work. Like I literally planned and read things before bringing it up in the conversation, it worked well for me. And my toxic manager also got fired this year and my new manager is amazing and is very polite and respectful. I feel valued and more confident doing my job now and got a raise last month. Just want to say thank you for all the help and kindness that you guys have shown to me.","I'm considered one of the best presenter in our division because of how I can ""control the crowd"" during discussions.  I've also been told I can read a room like a book and know when to add in humour.    Little do they know, before any big meeting, i spend a good 15 minutes in the bathroom trying to stop myself from shaking, crying, and vomiting.",5704
gcmnul,"Mine was back in 10th grade. I was talking to my crush and was scared I sounded boring to her. So in my head i kept thinking ""say something that makes you look more interesting"" I panicked and told her I didn't support gay marriage... it's been 12 years since and I still cringe when I think about it","When i was 18 my girlfriend told me about how her ex used to beat her. Me being stupid and macho i went to say ""i bet i could hit him harder than he hit you""(dumb i know but it gets worse. I fumbled my words and accidentaly said ""i bet i could hit you harder than he could"" Still not only cringe at that but feel genuinely sorry for that girl. At that age going through an experience like that and opening up to someone about it, and they say that. Shiiiiiit",6622
gdhhx0,"In the four years that I’ve been a mod here, this is by far the most bitch made statement that I’ve ever had the misfortune of reading. It always comes from some weak ass chucklefuck who thinks this sub is his safe space from “those dastardly wimmenz crowding his precious AskMen sub that he just started posting on last week”. You can tell that these people don’t post here either because it’s never any of the regulars that do this; let’s be real though, we know the exact type of person who says this shit.  From this point forward, if you get caught making this comment to any of our users, you’re copping a permaban. Gender will not be a reason for a user to be unwelcome on this sub.  tl;dr: don’t be an asshole E: for those who didn’t know, [this shit doesn’t fly either](https://www.reddit.com/r/AskMen/comments/8co4eu/announcement_there_will_be_no_more_women_of/?utm_source=share&utm_medium=ios_app&utm_name=iossmf)","Well, since the sub's name is askmen, logically speaking this is not men ask men or women ask men, it's everybody ask men, right? Edit: wow, I didn't expect to receive awards for this. Thank you so much kind strangers. These are my first awards ever. I'll keep them in my mind, and in my soul and on my reddit profile xD",6456
gdsr2r,"Mine was when a girl friend of mine asked me for a picture of when I was in the army. I showed her a picture of me holding an MG3 gun standing on a tank. And then she tells me ""you're too cute to have a gun"". So, what are your stupid reasons?",My cousin older than me by two months said she didn’t want me to cut the fruits because i might hurt myself and insisted that she do it. We were both 20 at the time.,7784
ge7iia,"Personally, it has given me (23F) a completely new perspective on the pressure that men feel from society on a day to day basis. (It also taught me the importance of a good sundress) Edit: a word **thank you for the awards, kind strangers!","If something can be done in less than 5 minutes, do it now",6271
gemiod,"Probably tmi, and I should probably make an alternate account for this, but I don’t actually care that much. Yesterday I went for a walk after being inside for most of the past few months, and to take advantage of a beautiful day, but when I was about two miles away from my place I had the sudden urge to drop a deuce.  Unfortunately, I was in the downtown of my city at that point, and I literally could not find any open store or any bathroom. As I waddled towards my apartment, I knew I probably wasn’t going to make it. I thought about calling an Uber or my brother, but by the time I made up my mind I was too late. I soiled my favorite jeans, and then just stood with my back against a bush, confused, shocked, and unsure how to proceed. I stood there for like 30 minutes-I was too far to walk home, and I sure as hell wasn’t calling anyone to pick me up. Finally, once it got dark, I realized I’d have to try to make it home. Even though I could feel the shit in my pants (which stayed warm for way longer than I expected...ugh, gross), I couldn’t wait on that corner any longer. About a block from my incident, I found one of those electric scooters, which I immediately set up an account for and rode home. I grabbed a garbage bag, went to the shower, cleaned up, and then crashed on my bed and thought about how weird this whole year has been. Anyway. Have you other guys ever pooped yourself? Edit: now my Inbox is full of shitty stories. Best distraction from work ever lol",They say that the greatest mark of self-confidence is farting when you have diarrhea... Let's just say that once I felt confident.,5471
gh3783,"Sup, shitladies. We need to talk.  I'm removing 500 of these fucking posts a day and frankly, the shitlords of AskMen shouldn't spoon feed you basic information on how to best love ***your*** fucking boyfriend. Use context clues and your accumulated knowledge of him and FIGURE IT THE FUCK OUT.  Or fucking google it, I don't care. You'd think it would go without saying that the best way to make your sooper special boyfriend who you loooove so fucking much feel special and loved and appreciated ISN'T by asking millions of dudes WHO AREN'T HIM how to fucking treat him.  If you're STILL just ten working fingers and an empty, echoing glass jar where your brain should be when it comes to ideas, then go to fucking /r/gifts or /r/dating_advice. Or you know, you could just ask him.  I hate you. Now, go away.","To all the empty glass jars who think Hatch did this without consulting us, the rest of us could not be happier with this. If you're reading this and sincerely believe askmen can help fix your relationship, you should just break up now. And because I know modmail will be full of people who think that they're special and that their dumbass post should be put up anyways, [this is our response](https://i.imgur.com/BAktJnU.jpg).",6892
gj18u3,When old dudes just casually walk around naked in the locker room not giving a fuck. Why is it only old dudes that do this? Anyone under 70 just tries to subtly change quick and get out Also one time I was working out and the 2 girls on the machines next to me started making out and asked me to join. How rude! Give me some privacy!,"Not putting your weights up, or putting them up incorrectly",5444
gmh101,"Trying to settle a debate. ETA - before as in before you get undressed and ready to hop in.    ETA again: Thanks for all of the responses, although you have made me conclusively lose the debate. To clarify, I get undressed, step in the shower, turn the tap on for a few seconds, position the shower head away from me, switch from tap to shower head, stand at the opposite side of the shower to dodge the water for a few more seconds while it warms up, and then proceed with my shower. I truly thought this was what most people did. Eye-opening. ",Let it run before. What are you a savage?,9738
gnion9,"I don’t know the technical term so dick flap it is.  I find this infuriating. A lot of underwear are now moving to this model. Did I miss the meeting where we collectively decided this?  How am I supposed to pull my wiener out in a timely fashion? Who has time to undo their belt, unbutton, unzip, and yank them shits down?  Talking so my wife she said: well perhaps women made these in retribution for their pocketless jeans. Payback’s a bitch. Edit: y’all got me cracking up with some of your comments. Who would’ve known this would be controversial?   Someone’s comment had me roaring: op pulls his dick through his pajamas for sex. All I could think of was Dave Chapelle and his white guy routine on the trading spouses skit. Thanks for the award kind stranger! Also I’m thinking about developing an underwear exchange app in light of the controversy. It uses machine learning to identify shit stains so no sneaky business.","I hated the thing. Not *once* have I used it. It only served for my dick to poke through when I had a boner. Good riddance, I say.",3673
gp8zud,"Yes im 19, I live with my parents, I'm in first year university, but adults ask me things like ""so you still live with ur parents?"" Etc etc. I'm still confused in this world as i was at 16 and i still feel like a kid. I don't have a excel document w my expenses or anything like that. I feel like a typical teenager still. So yeah Edit: I can't believe this blew up omg!!!! Tysm to everyone who gave advice I'll try to read it all by tomorrow. THANK YOU KIND STRANGERS ❤️","When you're 35, you're still going to feel like the same person. You don't wake up one day and think ""hey paying bills is fun I think I'll do that instead of paying video games""... You just realize that this is you, this is your life, how good is it going to be? And you make choices that get you where you go next. The only thing that really changes is your level of experience.",6668
gr1cz8,"I work with a bunch of moms and grandmas, so they're always showing me pictures of their kids/grand kids/nieces, I don't really know why because I'm 22 and have no kids lol. But anyway, I never really know what to say so I'll literally just go ""Oh"" and try to think of a good question about them. And often times it's some college hottie that I'm surprised is related to whoever's showing it to me. So what am I supposed to say? EDIT: alright I think I've got it figured out guys, thanks, I was probably overthinking it Hope my next post gets this big a response because it's gonna be a lot more important lol EDIT: oh my lord I do not give a shit about this post and it's my biggest ever, fuck my life. Meanwhile any post I actually care about gets <10 comments. This is why I can't have nice things.","""Is that your sister?""  Old ladies love that shit.",14531
gs7eku,So i used to not be able to feel much during sex. Which was good and bad. Good because i could fuck for hours. Bad because i literally had to focus on something really specific to cum. Nowadays my penis is extra sensitive and honestly i liked it better the way before.  How do you reduce sensitivity?,"So, to actually answer the question seriously. If you aren't circumcised, you can run water over your exposed glans while showering, every day. If you are able to roll up the foreskin and keep it that way while wearing underwear, you can also try that. If you are circumcised, wear boxers or go commando. Basically anything that causes your penis to jiggle around and the glans to rub against the fabric as you walk, as opposed to boxer briefs that just pack everything tight and safely in cotton. None of these will physically change your glans, but rather they adjust your brain's baseline to stimulus. Kind of like how you stop hearing your fridge after some time in the kitchen.",9793
gvjnvd,"Sup shitlords, It should be excessively obvious that we stand with the people who have been perpetually disenfranchised and oppressed by not just the police in recent days, but by society for decades.   It should also go without saying that under no circumstances will racist dialogue be allowed here.   If you're interested in doing some reading about what you can do to empathize/better yourself, please see these links.  Any further links will be appreciated and added to this list: * [75 Things White People Can Do For Racial Justice](https://medium.com/equality-includes-you/what-white-people-can-do-for-racial-justice-f2d18b0e0234) * [Who Gets to be Afraid in America?](https://www.theatlantic.com/ideas/archive/2020/05/ahmaud-arbery/611539/) * [Covid-19 has infected and killed black people at alarming rates and data proves it](https://www.motherjones.com/coronavirus-updates/2020/04/covid-19-has-infected-and-killed-black-people-at-alarming-rates-this-data-proves-it/) If you are interested in giving money, please take a look at these organizations, although I would stress looking for one that's local to you as well: * [Campaign Zero](https://www.joincampaignzero.org/#vision) * [Anti Police-Terror Project](http://www.antipoliceterrorproject.org/) * [Equal Justice Initiative](https://eji.org/) Finally, as it seems like Reddit is going to continue providing a platform to the racists who want to perpetuate a culture of hate and divisiveness, we'd like to provide some ways to weed out the assholes since a bunch of them like to frequent this sub: *  [start with this article detailing how the alt-right radicalizes young white men on the internet](https://medium.com/@DeoTasDevil/the-rhetoric-tricks-traps-and-tactics-of-white-nationalism-b0bca3caeb84).   * [Here's a bit about the Southern Strategy, which is their original playbook](https://en.wikipedia.org/wiki/Southern_strategy) If you start seeing these arguments, just stop responding and report: * ""unpopular opinions"" by r/AsABlackMan with ""I'm black and it's okay to hate blacks"", ""as a black man, injustices and abuse in America shouldn't be discussed as much,"" ""as a China man, dogwhistling racism about China is okay,"" ""AS A FEMALE,"" etc.  FWIW this is the reason we don't allow ""what' your unpopular opinion about X"" threads. * ""facts don't care about your feelings"" * racist terms don't bother them, so the real injustice is not being able to use racist taunts * ""misogynists and feminists are equally bad""  * ""racists and anti-racists are equally bad"" * concern trolling ""it's okay to be white,"" ""blue lives matter,"" ""all lives matter""  tl;dr **Black Lives Matter** Love, The mods ETA: looks like those racist trolls are here in this post using the exact same tactics and arguments described in the post.  Please feel free to report them, or make an attempt to engage them in conversation if you dare. 2nd Edit: And now we're locked.  Let this be a reminder to all of you people who think ""aSkMeN cAn hAvE a sErIoUs diSCusSiON aBOuT iMporTaNT isSuEs""","Also, before you shit your pants. The term ""Black Lives Matter"" is operating under the premise that all human lives matter, just that society treats Black lives less sacredly than other lives, so STFU with your ""WHY NOT SAY ALL LIVES MATTER?"" IT'S NOT SAYING ANYTHING NEGATIVE ABOUT WHITE LIVES AND *IS* SAYING ALL LIVES MATTER.",1
gx0try,"How would you describe an attractive person? Edit: Text to speech exists people. I dont mind the joke, but yeah there are accessibility options if anyone was genuinely curious.","I have a blind cousin. I don't know what genuinely turns him on, lol, but I remember him regularly commenting on the way a woman smelled. He met his current girlfriend at a function I happened to be with him for. She spoke to us, she made him laugh and just was a really pleasant person. When she walked away I mentioned that I thought she was cute, he said, ""and she smells like spring time"".",15247
gxgx5c,I live on my own and am single. Has been quite hard spending so much time alone and not being able to go and socialise. Just sending some love to some people that might be feeling quite lonely as I am. EDIT: well I woke up this morning to a wash of love and advice from you all. I appreciate it and will take allot of it onboard. It’s so nice to see everyone showing love and support on this time! Stay sexy people!,It's a mix of enjoying it and wanting to die.,5154
gyuzot,"Edit: Thanks everyone, I've read all your answers and there have been some really helpful bits of advice. I appreciate it. Will probably delete this post soon so don't keep getting notifications about it but thanks for your help. &#x200B; I (M35) have just found out that my father has been accused of raping a child that I know. He will go on trial later this year. He has always been an excellent father to me, I love him and I can't believe he would do this, but I also can't believe that the child would lie about this since going to court will be massively traumatic for them too. I don't live near them (and Coronavirus has shut down travel in my country) so from a distance I'm trying to support my mother, who is so distraught I'm worried she will have a heart attack or something. I'm also trying to support my father, because if he is innocent then I cannot fathom how gruelling this is for him. And if he's guilty then our justice system and everyone else on the planet will take care of punishing him. But I feel like I'm going a bit batshit myself, because I simply have no idea if I should feel sorry for him or be disgusted by him, and I flipflop between feeling incredibly sad and feeling burning rage. It's extra cutting because I would like to have a child myself, but I'm gay and my long-term partner isn't interested in kids, so I was already feeling down about that but was on the way to accepting it. Now I feel like my whole family is destroyed. I send my mother messages daily and she says they keep her going, but some days I just feel so sick about the whole thing that I want to cut myself away from it completely - like when someone dumps you and you cut all ties and block them so that you can get over them and move on. How can I support my parents through this ordeal without it destroying my own mental health?","I have been in a situation where one of my ex-girlfriend's family members turned out to have committed sex crimes against children and grown women (and was guilty). He had also been a good father to her. My observation was that this entire thing is going to pass through multiple ""stages"". Your mother's relationship with your father will be tested, as will yours, and you will probably experience alternating periods of being aligned and badly misaligned with various factions of people involved, as well as periods of peace and turmoil within yourself.  Stoic philosophy has much to say on this issue. You are in the type of situation where ""thinking ahead"" is impossible, for the future is riddled with moral questions and complex legal processes that will do nothing but create anxiety in yourself should you put your mind there. In stoicism, one looks only to the present moment and present problems, focusing your mind on the tasks that currently fall within your control and not casting your mind further. Practically speaking, this means choosing your next action and your next thought, but little more. Keeping your mind on the immediate, practical and controllable will minimise your anxiety and permit you to be a rock in a time when everything you've come to know as stable is changing.",8666
h0jtnd,"I'm baffled by the number of times guys have told me they don't have a condom with them. Are you not expecting to have sex? Are you expecting to have unprotected sex? Common sense says if I don't know your last name, you're not fucking me bareback. I always have condoms in my purse (in a metal case so they don't get messed up). But every guy has their favorite brand, so it's not always the ones they are used to. I went into a sex shop the other day and asked if they sold assorted size condom packs and the dude looked at me with a look of total confusion and said no girl had ever come in looking for that. EDIT: Most of these are people I've met online. I'm pretty forward about the fact that I'm ""not looking for anything serious"". EDIT2: Thank you for all the replies and feedback. I have learned a lot about other people's perspective on this topic.  1) I'd like to say that just because I enjoy casual sex, that does not mean I have no standards and will have sex with anyone. And it certainly does not mean that I want unsolicited NSFW photos in my inbox.  2) I was previously under the assumption that most people who engaged in casual sex used condoms for STI protection. I now know that this is not a valid assumption and I will be more proactive in discussing this with partners.  3) I realized I can be more direct in the way I communicate prior to meeting someone and during the encounter.  4) I never thought about the fact that guys don't have a purse with a bunch of random ""just in case items"". So carrying a condom is a conscious choice before going out.  5) I confirmed that some guys are assholes and will try to manipulate me into having unprotected sex even when I explicitly stated this is not okay with me",just ask for his last name then sheesh,5427
h7xn9w,What are the positives and negatives? Do you regret your decision?,"Dated a blind woman for about six months. It was different in some ways, most of them mundane.  Like we didn't go to the movies and I drove all the time but it honestly wasn't any different in any way that matters.",5579
h8v84k,"Copied this from r/askwomen lol. EDIT: I'm trying to read all the posts and reply to the ones I can relate too. Thanks for taking the time to comment =D EDIT 2: Too many fucking comments, I can't reply to all sorry LOL.","The general assumption that men have no idea what it’s like to be a woman, but women have perfect knowledge about what it’s like to be a man.",11719
hbk6iz,"I (24f) recently started seeing a new guy who waited until we were in bed about to get it on to tell me that he doesn’t wear condoms “on principle.” He said that he’s used them before for one night stands but not people he “talks to” because it doesn’t feel as intimate or close. I told him that down the line if we got tested and were committed it would be different, but this would’ve been our first time so I was not gonna let that fly (personal/sexual health is not something I am willing to compromise). It led to an argument which ended with him saying girls have never had issues with it before and leaving. I, slightly hurt and feeling rejected, just took this as a load of f*** boy bs and kicked him to the curb. I talked to other women and found out that it’s not an uncommon phenomenon. So what’s the deal, men of reddit? Do you wear condoms? If not, what’s your reasoning? Edit: wow so many responses to get through! For clarification: this was 5 or 6 dates in, but we had not committed to anything yet... not quite a relationship but not a random hookup either","I wear condoms 100% of the time unless we're exclusive. Anyone taking fewer precautions or *telling you* to take fewer precautions is sketchy af. I got chlamydia the only time I ever didn't wear a condom, and it blew my mind how unlucky that was *and* how fucking lucky I was that it wasn't any other disease like gonorrhea or genital warts or herpes or something for life.",10859
hbzvh2,Here is an example that applies to me  Stereotypically Masculine: Whisky and BBQ Stereotypically Non Masculine: Musicals and Drag Shows Edit: Holy crap I love all these answers and did not expect this to blow up as much as it did!!,Masculine: Hockey showers with the boys.  Not Masculine: Hockey showers with the boys.,8382
hdadnw,Title,"My college crush asked me out on a date and I was so happy.  Show up to the restaurant, she arrives, we get a table and start chatting.  About 10 minutes in, another dude shows up and sits down with us.  I'm super confused, but she introduces him as a friend and I mean.. what am I suppose to do?  A few minutes later this dude goes to the bathroom, and while he's gone she leans in close to me.  Tells me this is the guy she really wants to date, but she's not sure if hes right for her.  She wants me to evaluate him because she really values my opinion and wouldn't date a guy I didn't approve of. She didn't exactly make a booty call in front of me, but she asked me on a date to get my approval for the guy she really wanted.  Some things stick with you forever.",10037
