Post_ID,Post,Comment,Score
ifkhr2,"Like for example walking almost three miles across the city at an ungodly hour just to meet up with her or something. Just an example, definitely not anecdotal.","Meet her at a party in her hometown which was located 2,5 hours drive away from where I lived. At that time:  - I didn't have a car so I convinced a coworker to go  (and drive us in his car).  - I was a smoker. From the time I called the girl that day to ask her out (around 2pm) I stopped smoking because she didn't like cigarettes.  - my coworker was also a smoker. I asked him not to smoke inside his car so I wouldn't smell like cigarettes. He wasn't happy with this request but did what I asked. My coworker and I finally made to the party to find that the organisers only accepted cash. We didn't have enough cash for the tickets. The girl didn't bother coming outside to help us out. So it's around 10pm and we're trying to find an atm to get more cash. Please note: we were in a small town in a third world country.  We asked around and learnt there were two atms around the area:  1) inside a petrol station 2) inside a shopping centre We drove to the petrol station and the ATM was not working. We drove the shopping centre which is supposed to close at 10pm. We get there at 10:15ish and we see some people leaving the place. we tried to go inside to use the ATM but the security guard doesn't allow us inside because it's past 10pm. 20 minutes later I managed to convince him to speak to his manager (who's at his place enjoying his Saturday night). His manager answers the phone and after cursing and wishing my family the most horrible things you can ever imagine he does authorise us in. The security guard escorts us to the ATM. We get the cash... Victory! We go back to party and we're finally able to get in. I called the girl a few times and she doesn't pick up my calls. Few moments later I managed to find her... Hooking up with a guy.... And holding a lit cigarette!",12746
igcd6o,"I’ll share my story. At the time, my girlfriend and I were 69ing. Well she likes me using ice cubes so I grabbed one, laid down, and let her get on top. About a minute in, the ice cube melted just enough to where I somehow let it slip and went straight into my throat choking me out for a few seconds. I threw her off me and she fell on the floor all in a panic. Only a few seconds later I swallowed the whole thing and we were laughing with tears and called it a night.",I was trying to strip in a sexy way and tripped over my own clothes and the surprise of it all unclenched my bottom and released the fart I was holding in.,11368
igwadn,"If anything, this sub has taught me to:  - give lots of hugs - compliments  - give flowers (been doing that to male friends when we meet to catch up) - be the emotional support and listen because men don't get that enough  - empathise and understand the struggles men are also facing  - positive affirmation when they feel shitty   The adorable smile when men realised they are finally being seen, being heard, being appreciated. I could die in that pure adorable smile! How are you all so adorable? Do you know that you are the most precious beings? Especially the dorky lost smile of ""oh shit, she's listening"" is the most sacred thing in the world that needs to be protected in the Louvre alongside Mona Lisa! How the hell do you do that! Were you born this way? Men are adorable. Edit: omg I didn't expect to get this response. I'm not a troll, a very real person. You all make my heart so happy with your replies. You are love, and are as valid and beautiful as every puppy in the world. Go kick today in the butt and be the person you've always aspired to be! I'll be thinking about all of you. And yes, I love you all very very much! Edit 2: to those thinking this is a scam:  > Just a stranger on the internet. Nothing to sell, nothing to take from you, no strings attached. Just risk-free compliments baby!  So if you find courage inside of you, I hope one day, you can learn and choose to accept that these words are for you. Because you truly deserve them. I genuinely mean it, with all my heart.","Oh, you. *hehe*.",5941
iip0dg,"I have a boyfriend and although I can ask him, I was wondering what your experience was and if you guys have any tips for an amateur","For uncircumcised - the foreskin only retracts so far, don't just pull it all the way down or you'll snap the banjo string.",10308
ijbgma,"For me, it made me realize I have no friends. And people won't talk to me unless I talk to them. These are very lonely times.",Right there with you. Zero real friends. Nobody to share music with or cook for. Hurts. A lot.,3784
irynbu,"Title. Let's hear some personal stories so that hopefully, others viewing this thread too will get some good ideas for self-improvement (If needed), or know not what to do around their crush (either men/women).",Told someone something I told her in confidence,9377
iu308d,"I made salted caramel from scratch, and without corn syrup. But were they impressed? ""Congratulations, dad. Now you can cook *three* things; this, almost hard-boiled eggs, and sometimes toast."" We're a hair's breadth from one of them coming in and just telling me to shut it down... --- Edit: Thanks for all the advice and the laughs, everybody. This weekend I shall make Pasta Aglio e Olio the likes of which not even God has seen!",Personally I think you’re going the wrong way with this one. Lean into this shitty cook thing a bit with their food. Hot dogs and macaroni and cheese. Cereal and more boiled eggs.  For YOUR food make some of the suggestions that you are getting here. Then you can brush those haters off,8849
iulzpo,"Went shopping with sister and girls have all the funny pun shirts like:'exercise? did you mean extra fries' , 'owl you need', 'donut worry'? I want to lift my weights while looking great not have plain black shirt or some skull retardation. Where are such shirts for men? I guess that's the price of having pockets","There is a thing in strongman that competitors have ""kinda fit, kinda fat"" on their shirts. Always liked that one",5848
iw63xo,"Idk man, I feel like this is a great feeling, for a shit ton of reasons depending on your personality. It can be “man I can do this shit.” Or maybe you’re less familiar with sports and are not confident talking to them about people and you think “man I know more than I thought.” I don’t know why but that’s a good feeling.",I know basketball so that happens enough when I watch that. It feels good. It just verifies that you know what you’re talking about.,1352
ixlf8a,"Taking responsibility, admitting faults, not just knowing when you've fucked up, but learning from it and fixing the problem, not making excuses, etc.","Knowing the difference between ""I have money, I can buy that"" and ""I have money but I cannot afford it at the moment"".",7279
j60z5o,Thanks!,"Show, don't tell. Show them a lot of attention in the bedroom. It's easier to do if you genuinely love and prefer them small in general, like me, as opposed to loving them *because* they're your girlfriend's (which is the sense I get from your post). The latter is very good, of course, but I guess it comes more natural to you when you are crazy about small ones regardless of whom they're attached to.    In any case, you should show them a lot of love while you're having sex. But also outside of the bedroom. Praise her figure, tell her how good her body looks in certain clothes, suggest she wears certain dresses or shirts because you love how her boobs look in them, cop a feel or fondle them on unexpected moments (when you're alone together, obviously) and say you just couldn't help it because they're so hot.     Or leave your laptop open to a small boobies nsfw sub, so she sees you're really into them ;)",5234
j8cf48,"A new senior supervisor started at our workplace a few months ago and I would be working under him as a particular zones supervisor. I'm 30 so I'm out of the ordinary supervisor age and looks etc normally its an old boy thats been in the industry forever.   I see the new dude in the car park and go to introduce myself. He looks me in the eye as he's walking towards me then slightly goes to my side and keeps walking as my arm is outstretched for a handshake and I'm halfway through introducing myself.  I was standing there pretty baffled about how rude he could be but then chalked it up to not realizing so after he goes into the office and comes back out I assume he has found his bearings so fast forward a minute or two and we both find ourselves at the coffee station and I go back in.. outstretched my arm and go ""hey mate I'm co-"" and he cuts me off. ""The milks empty can you get me another.""  Just talks at me, time to give the boys their prestart before we get out there. About 40 of us and I'm giving them the talk, I had to introduce the walking erection called Darren. I said ""Everyone make Darryl feel welcome as he's our new senior supervisor. Everyone say Hi Darryl""  *HI DARRYL* x40  Darren trys to interject to correct me so I talk over him and let the boys know let's get to work so everybody left. It took him about 4 weeks to correct everyone seperatly for his real name but even now people call him Darryl.  Fuck you Darryl","When I worked at a grocery store I was in the meat dept. We closed the counter at 8 and cleaned until 9. My dept manager said if we finished cleaning early we could head out. But he was 9-5 so he wasn’t around. I worked there for some years, and as the years went on one of the front end managers that did closing didn’t like us leaving early. It wasn’t up to them. They were not my boss. At some point they implemented a policy where we had to call the front desk and they had to come verify cleaning was done and sign off on it. The manager that didn’t like us leaving early would say he was coming when we called, but then he just wouldn’t come til 9 to verify so that he could keep us there the whole time. So my solution was, after I finished cleaning I would just walk to the front desk and find him, and tell him I was ready. He would say “OK, be right there.” And I would say “OK, I’ll wait.” And I would just stand right next to him until he went to check. He hated that.",6608
jabss3,EDIT: HOLY SHIT! I just got back to this from break. Thank you all for the advice and the positive feedback. Seeing how many of you were in similar circumstances really makes me feel hopeful! Here's to you all!,"I've never quite had an addiction, per se. But when I had a hard time cutting back on beer, specifically, one thing that helped was to buy soda water and drink that instead. The carbonation helped trick me in a sense that it was giving me the same sensation that a beer would.  Sorry if this tip is totally useless or irrelevant in your case.",3549
jb7qjw,"A thought crossed my mind. My ex loved getting hoodies from me and wearing them all the time. I would always give them to her because in a way it was kinda nice to see someone enjoy them as much as I once did.  But I was wondering, what is the equivalent for guys? Is it getting one of her scrunchies? Edit 1: thank you random stranger for the silver! You’re too generous :D",Using her shampoo and conditioner bottles in the shower.,11369
jcpdyt,"During an intense session, my eyes roll back and I lose control of my body. I wonder if y’all think it’s hot or do you think we look possessed? Please explain.  Edit: Goodness! I didn’t think I would get so many responses! Thanks for the awards, I’m not sure what they do cause I’m a reddit noob (do people even use that word anymore?) but I appreciate them nonetheless.  Overall consensus is that it is hot to see your partner overcome with pleasure and men appreciate/love GENUINE feedback that shows you like what they are doing. Faking reactions seems to be a no go. Good to know.  Thanks again for those who responded. Have a pleasure filled day! ",I like whatever reaction is genuine. Fake reactions or over reaction is a big turn off. Just be you.,7658
jdeymq,Against my Better judgement i said Well I’ll give you some space Apparently it wasnt the right response. Thanks for making my day. It’s bound to happen again so I’ll save some of these for later.,Dress up like Sherlock Holmes and inspect everything in the house with a magnifying glass while saying hmmm.,18624
jf9szd,Any resources/articles that touches on this topic?,"It feels like either I need to figure out how to help myself or just die. Those are the only 2 options. It's given me a really bitter outlook on people and what my life is supposed to be, because I can't help myself, I've been trying for years. It's like the world wants me dead, but I won't let them get their way.",5391
jjpy34,Just had sex with the guy I’m seeing and he had me speechless from the moment he started touching me and had me feeling so good I could barely think. He let on that he’d been doing some reading up and that’s where the new moves came from so I’m looking to pick up some of yours to try to get him in the same zone.,If she says wild and crazy things like 'I want to have sex with you' or 'let's have sex'. Really blows my mind.,9732
jmylgi,"[Seriously, none of us care.](https://imgur.com/KpZhPUQ)  [Nobody.](https://www.redgifs.com/watch/gorgeousfrightenedcarpenterant)  [Like nobody on this sub cares about what you do with your dick.](https://redgifs.com/watch/fatblondhound)  [Nobody in your real life cares about what you do with your dick.](https://www.reddit.com/r/hentai/comments/gywoue/women_in_simple_bras_are_so_underrated/)   [You wanna go and not masturbate for 30 whole days?](https://www.reddit.com/r/gonewild/comments/fnit9d/the_world_is_ending_so_fuck_it_ill_show_my_face/)  [Cool, I don't give a shit.](http://i.imgur.com/yJbiTRk.jpg)  [But I don't want to hear about it.](https://i.redd.it/f2tbqa8pmlf31.jpg)  [It's like furries:](https://gfycat.com/periodicniceafricanfisheagle) [you want to put on a fur suit when you fuck?](https://redgifs.com/watch/enlightenedsaneeyra)  [Cool, but don't tell me, I don't care.](https://i.redd.it/vi40eacug5a41.jpg) [I don't know why you people think that talking about your masturbatory habits on reddit is like...not at all weird.](https://i.imgur.com/x6tbs1O.jpg)  [If you were talking in a coffee shop about how it's really hard that you haven't shocked the monkey in a couple of weeks, everyone would be thinking ""man this person is a gross weirdo"" and they'd be fuckin right.](https://i.imgur.com/nSHfpD2.jpg)  [We're not your buddies, we're not your guys, we're not your pals, not even your friends.](https://gfycat.com/helplesstautgazelle)  [We're just lonely, angsty, jaded dudes (who are likely virgins) who don't really want to hear why it's hard for you to not nut.](https://i.imgur.com/XZbi991.jpg) [You wanna make a difference for cancer research (which is why No-Shave November actually started)?](https://no-shave.org/)  [Read up on how masturbation actually is linked to lower rates in prostate cancer for men](https://www.webmd.com/prostate-cancer/ejaculation-prostate-cancer-risk#1).  [Or just donate to a prostate cancer foundation](https://www.pcf.org/). [In any case, posting questions about how your shitty month is going with regards to your masturbatory techniques will result in a ban.](https://i.imgur.com/vcGlmhL.jpg)  [Nobody cares, and if you want to be one of those soulless losers who is gonna join the nofap club, they have a sub for that](https://preview.redd.it/uttkvuniuax31.gif?format=mp4&s=708cc0622fb4b802c32fb2f2ba91ac80fd868259) [inb4 you annoying idiots who will say ""but masturbation is addicting and pron addiction is a real thing"":](https://i.redd.it/7basef8kk2u21.jpg) [No one is saying porn addiction isn't real, but also porn addiction isn't a thing that only happens in November.](https://gfycat.com/eminentelderlyhartebeest)  [If you feel like you are having problems with porn addiction then your first call should be to a therapist or a doctor, NOT Reddit idiots who are going to point you to the redpill or nofap shit or things that are just as bad but in the complete opposite direction.](https://imgur.com/k04hbl9)  [Moderation is real and is possible, you just need to learn self-control.](https://i.redd.it/v2lr2mcfmlb51.jpg)  [If your response to feeling like you can't control your ability to indulge in potentially addicting substances is to not only blot them out entirely cold turkey but to advocate for their removal, then you're not part of the solution, you're part of a completely different problem.](https://i.redd.it/tws6rnx4v8h41.jpg)  [The world does not exist in black and white, but in many shades of gray, so best to start learning how to operate in shades of gray before you go crazy.](https://gfycat.com/severegoodnaturedburro) [Much love,](https://i.imgur.com/2IRLFSq.gifv) [The mods](https://i.imgur.com/dW0dyNh.jpg) [Edit: It was pointed out to me that there were only white women in this post.](https://static.boredpanda.com/blog/wp-content/uploads/2020/11/pokemon-cosplay-mashonem-1-5f9fe05dc5347-jpeg__700.jpg)  [The reason for this is because I pulled all my links from a porn multireddit that one of the other mods gave me.](https://static.boredpanda.com/blog/wp-content/uploads/2020/11/pokemon-cosplay-mashonem-2-5f9fe13725f98-jpeg__700.jpg)  [I didn't actually look at any of the pictures I posted, so if you want to be mad at anyone, be mad at reddit for only liking skinny white women.](https://static.boredpanda.com/blog/wp-content/uploads/2020/11/pokemon-cosplay-mashonem-28-5f9fe44050003-jpeg__700.jpg)","You missed an opportunity to link gay porn with the ""the mods"", ngl",10023
jn87jv,"I've always been bad at not getting up until the very last minute possible. Lately with working from home being a thing, I've been rolling out of bed 1 minute before my shift starts and turning on the laptop. I feel like I'm losing a lot of actually usable time during the days. Any advice on sorting myself out?","oh, I actually know this one   Ok, first things first:   MOVE YOUR PHONE AWAY FROM YOUR BED FOR FUCK SAKE. Preferably put it on a Drawer where the Alarm will still wake you up but you have to get up to deactivate it Put a Glass of Water next to it, that you Drink, this wakes you up, get's your Digestive system going, AND Hydrates you, then take a Shower, use the Toilet, just make sure you leave the room.    Do this over and over again to build a routine, even on off days where you don't have    school/go to work/have to get up later than usual",5587
jo6e2p,"As I grow up and talk to women, it seems like they don't get ate out often. It is hard for me to imagine as I am a lesbian. No judgment; want to hear some different perspectives. Edit: Thanks for all the awards!","I once was hooking up with a guy regularly who never went down on me. When I asked why, he said it was because I was bisexual and therefore would have been eaten out by women, which he found intimidating.",16408
jpw4sp,"Every time I’m about to build the momentum to ask out a girl I get this crushing thought stopping me in my tracks... what do you do when you have a girlfriend. Like in the moment it sounds scary in my mind but after I leave abandon the objective to ask her out or talk to her the thought sounds stupid. But I mean I Would I have to be there for her, be the best me at all times.  I’d rarely get alone time.  Im probably not making any sense right now Edit: I didn’t go into detail too much and I also didn’t expect for this to blow up so let me explain a lil bit more I’m afraid of commitment, I’m afraid I’ll be boring, im afraid of a relationship. Im only 17 I never had gf before  I was always too shy and nervous, but I forced my self out there and girls started paying attention to me. And now I don’t what to do. I wouldn’t now what to do and I’m afraid of all the reasons I listed do you know what I mean.","In my personal, rather stoned opinion a girlfriend should basically be a best friend who you also see naked. Aka don't get into a relationship unless you couldn't see yourself being best friends with the person.  Lots of people date someone who shares basically nothing in common with them then wonder why its not going well.",8445
jqkfeu,"The title says it all... Might be kind of random but I read some posts on reddit a few weeks ago about the reason men love to cup their balls (psychology of it). I've never done it before (I'm 25, not that it matters...) but thought I'd try it, because why not? And  it genuinely calms me down. It's weirdly relaxing. Is it just me or do any of you guys feel the same? Edit: Jesus Christ, so many replies and rewards. Thanks, guys! Did not realise it would be so popular...",You’re not alone... I sometimes find myself doing this when trying to get to sleep haha,3986
jsvg3g,"EDIT: This blew up. I honestly didn't expect to get this kind of reception. I'd like to thank my Mom, Dad, my sister for being the rock in my life, my cat who bites the fuck out of my leg every morning, the mailman, the ice cream store down the street.... Jokes aside, for the guys who are saying ""they weren't wrong about being ugly"",, realistically there's going to be someone that finds you attractive.",When i asked out attractive women and they said yes.,8325
jtclt5," Emotionally, I feel dead. Havent really had anything meaningful this whole year. What was supposed to be somewhat of trying to be a new more social person. Maybe finally meet a girl.  It’s been depressing, and stressful. It’s been a completely pointless year. Fuckit, my birthday never happened. Im still the same age, this didn’t count.  Edit: damn I didn’t expect it to blow up.",The only positive thing was the result of my COVID test.,5695
ju0uhd," I am 26 and I feel like I am wasting my youth. I feel like I should be out there, exploring, dating, meeting new people, having new life experiences but instead I haven't done any of that. I haven't really travelled outside of maybe twice outside my country. I don't really have friends to do these things with. I've kinda just worked and studied the first half of my 20s away. I always hear how your 20s are supposed to be the most memorable moments of your life. Instead I'm sitting on a computer daily. I feel like im wasting my youth. Now, admittedly, the pandemic serves as a catalyst for the realization of this notion, but even before the pandemic I felt this way just not as strongly as now. Anyone else? Edit: WOW! I didn’t expect this to blow up but I’ll be reading your guy’s responses for sure!  For the people saying I should just do these things, I don’t really have friends to do them with and don’t have a lot of opportunities to make them, so naturally I don’t have opportunity to travel, meet more ppl etc unless I do it alone which I’d imagine I’m not going to be very good at :(","27 here. Do not live your life based on what you expect others expect of you, brother. You do whatever makes you happy. Edit: Thank you everybody for getting behind this and for the awards! It's important that as men we support each other and end the years of expectations and pressures!",4487
juhekb,I was fucking around with my husband and pretended to be a guy on top. I realized within 5 seconds there was no way I could hold that position long enough to have sex.  How do y'all keep those positions up? Particularly missionary? Edit: I guess I should have my it clearer. Yes I get on top but I'm specifically talking about the physical act a man engages in while in missionary.,Suddenly the reason men have more muscle becomes very obvious.,7593
juwf7t,"Like, when you see another dude you’re friendly with and you give each other that non-verbal head nod greeting. What’s the difference between chin up and chin down?","Upwards: What's up man? How you doing? Acknowledgement of our knowing each other. Invitation to start talking. Downward: Acknowledgment of respect, agreement, understanding and/or wariness of each other or the situation at hand. EDIT: Thank you everyone for the awards, I appreciate them greatly. And I'm glad we apparently have a near-universal form of communication.",20416
jvc7u0,Just curious. If a 30 year old woman wants to get a bottle of wine with a friend and watch Frozen then it’s fine and fun. If a 30 year old guy wants to watch an anime with a friend then they are immature. Why?,"It’s a matter of intensity. If someone makes watching Disney their entire personality, that’s childish. The same is true with anime. If you want to watch anime with a friend, nobody cares. If you start expecting people in life to act like anime cliches, that’s when you have a problem.",9228
jwecpn,"So I just figured out my husband doesn't change his underwear daily. Sometimes he goes a few days between changes. He says that it's ""unrealistic"" for people to change their undies every day.  I'd be interested to know if there are things that I thought were basic hygiene rules that are not. Maybe I'm the idiot for going through a pair a day. I feel like women have set rules about brushing teeth and changing undies and stuff like that. Please tell me all!","Rule #1: if you can smell own stench, others have been smelling it for some time already.",15420
jygzdh,"He was easily 6’5 and 250lbs and I’m 5’11, 165lbs and wearing crocs. I don’t see how I was a threat.","Are you talking to my girl!! Move along she’s not interested in you!! I hope she’s not interested in me, she’s my sister.",4867
