Post_ID,Post,Comment,Score
dac1iv,"So I’ve got a couple male friends and I cook way more than either of them. Like two weeks ago I made a cake for the hell of it, I made lasagna bolognese on a date, made a chocolate cheesecake for a friend’s birthday, etc. One of them has home meal delivery, so simple stuff to cook, and the other doesn’t cook at all. The one who doesn’t cook at all is constantly jealous of how I have good food and then today said he thinks if my childhood had gone differently I could easily be gay because of how much I like cooking. I’m just thinking that might be the stupidest thing I’ve ever heard from him. I have yet to have any woman be opposed to my cooking and most find it really cool that I’m decently good at it. Edit: It’s not that I think it’s not masculine, until probably a year ago I’d never heard cooking grouped with feminine things. So I’ve never believed that’s it’s not masculine. I’m more wondering how people can be that stuck in that mentality of masculinity that they won’t try cooking just because they have a distorted perception. And then critic those who do. Also as everyone seems to be mentioning restaurant chefs I went and looked and it was 81% male in 2012. I didn’t realize it was that male dominated but definitely bringing that up if anyone mentions it again, as well as how essential it is, and apparently sexy too. Now about how to take advantage of that...",It’s weird because being a chef is considered manly but cooking at home is seen as a woman’s job,5855
dbzrgf,Asking for a friend ;),i like to round up most of the sheet and keep them between my legs + arms when i sleep on my side.,18238
dcppf1,"I absolutely hate myself for the way I look, talk and how smart I am. I have no talents and strengths to show case. I have never had a girlfriend in my life. I earn a mediocre salary which I probably don't deserve.  I don't know what to do... How can a guy be useless.","It's pretty simple. Negativity breeds more negativity. Misery loves company. That's not just a saying, it's an actual function of our brains. There's an area called the association cortex which is responsible for collecting information that fits our mood and world view. That's why you get a confirmation bias when you think you can't accomplish something and fail - and of course you reaffirm it by telling yourself ""I told you so!"" And I'm no stranger to this. The reason I know about it in detail is because I struggled with depression and alcohol addiction for almost a decade. And ten years ago, my attitude was very similar to OP. So believe me when I tell you that you do have talents. You just lost the ability to recognize them and the confidence to discover them. &#x200B; It's not easy to combat this. A lot of therapists recommend a happiness diary. And before you label that as eccentric bullshit, just hear me out. I changed it a little bit into a success diary that I keep on me at all times. I write down anything I view as a success, no matter how trivial it is. That starts with getting up in time and making the bed. Or a nice and friendly conversation in the subway. Motivating myself to go to the gym. A nice evening with the missus. And holy shit, most of the time it's not even noon and I already filled a whole page. And every time I write down something new, I'm being greeted by past successes. &#x200B; That's a very simple step to improve how you feel about yourself. Additional steps include trying new activities and stepping outside of your comfort zone, allowing yourself to succeed and accepting defeats and failures. I never knew I could be a decent archer until I bought a cheap bow and practiced it.",3711
dftzc9,"I just went for a wee, and it just occurred to me that it might not be the most straightforward thing to do if you've got a micro-penis in terms of pulling down your zipper and basically then holding it and going. I could be completly wrong though? Are there any challenges those with a micro penis face that others don't, how do you tackle it? (No pun intended). Genuinely curious, cheers!!","Y'all, just so everyone knows, if you are obese your dick will begin to retract into the protruding fat around it. Your dongle wont grow out with your fat, it just stays stationary. I am an emt/medic, and I am sure any RN can confirm this, the number of obese men I see in their 30's and 40's with implanted catheters in them is wayyyyyy to high, and its just because their unit has essentially been swallowed by their fat and a condom catheter cant be used. If they lost the weight many of them would have normal size members.  Help your dick (and your heart) out by loooooooooooosing some weight.  Edit: I will add an extra ""o"" every time someone tries to correct my spelling. Yall take the fun out of this website. Edit: fucking hell guys, let's come up with a simple analogy. You recently bought a cactus and want to show everyone your super awesome new cactus because you're really horny, and the cactus is really thorny. Problem is, you got too excited and  buried the damn thing up to its mushroom shaped head in dirt, causing it to be about the size of the average micropenis. THE CACTUS IS STILL THE SAME SIZE, you just buried it because you don't know how to take care of a fucking plant. All you have to do is remove the dirt around the cactus to a reasonable level so that people can see it in all its thorny glory. The plant never got smaller, you you made a lifetime of bad decisions and never exercised and now the plant has been swallowed up by soil and girls can't play with it and you can't pee anymore.",2379
dhaatq,"Kid me would be proud of where I am and what I've achieved... and adult me just disagrees. Social Media doesnt help either. I just feel so stagnant in almost every facet of my life right now for my age. How do you guys handle that feel? Edit: RIP my inbox. But, genuinely, thank you to everyone who replied. *Every* message is read, and thank you for the people who shared their stories. Edit: And like that, we're on the front page.... congrats?","I'm 28, I work in a coffee shop for $8/hr while I pay rent to my mom and dad to live with them as I'm trying to go finish the college degree I started 10 years ago and gave up on so I could smoke a bunch of pot after a failed relationship. I lost everything I had, my apartment, my job, many friends, my money, I had to go to rehab for a while, and now I'm almost 30 only making 75¢ an hour more than minimum wage, living with my parents (ugh), and paying OOP for school since I bombed all my grades a decade ago. Meanwhile, the girl I'm interested in is four years younger than me, has a degree, a job in her field, and is working on her masters while she moves into her own apartment. Sometimes I feel like I'd be doing anyone I'm romantically interested in a favor by staying away. But here's the thing. I could still be doing drugs. I could still be homeless instead of with mom and dad. I could be mooching instead of paying rent. I could have given up on school entirely. Yeah I'm behind in life and *literally all* of my friends have careers and are done with school except me. But I could be off worse and I'm not quite 30 yet, I can turn this all around by 35 if I work hard and don't give in to the dread and depression and self-hate. You can do the same. It's never too late.",7421
dhlzs4,"I dont think guys get told this very much. My boyfriend, my dad, my brother, they're all way too hard on themselves in every aspect of life and I want to spread the word that you guys deserve more credit. Society has been ripping into everyone lately. We're all just trying to make something in life have purpose.  In any case, I'm here to say You are valuable. You are special. You have meaning. Edit: I'm grateful this blew up, I've enjoyed reading your comments and getting insight from you guys. To the ones who have been told recently, that's amazing! Keep those positive people in your life! To the ones who said never, I hope that even in light of this truth, you still find yourself valuable and find someone who sees your worth. To the ones who made special ed remarks, whether it's true or not you're special too! And I hope you believe it in a positive way. And to the ones who mention that all of us being special makes no one special, to put it in perspective, the odds of each person being here is astronomical. YOU made it to the egg, your parents' odds of being here are astronomical etc etc. So yes, we are all here, but we were the fastest of SO many others! And that's pretty special. Have a fantastic day everyone!",My mom calls me special as a gentler way of calling me an idiot,3992
dku5sy,"thought that i knew what i was doing, now i’m not so sure edit: a ha ha if any ladies want to give some firsthand advice lmk...jk...unless??",wash your dick,7359
dmceec,"How can guys fuck so hard it sounds like a white man running in flip flops but when they get tapped on the balls, it's painful and nauseating? Edit: I'm female and just genuinely confused about ball pain Edit: Thank you everyone for your input, so far the leading themes are: ""You're wrong, they do hurt sometimes/every time"" ""You're doing it wrong"" or ""You're not fucking hard enough for them to hurt"" ""It hurts less when you expect it"" ""Ass/pussy softens the blow"" ""Pain threshold increases"" or ""we were made this way by evolution/balls don't hang as low when fucking""","Women have told me they like doggie because they like the feeling of my balls hitting their clit. So the OP's question is in fact, legitimate.",6685
dmfqdp,They all have cats. Usually more than one. I'm losing hope.,I'm in Texas most of the single women down here have dogs.,5220
dqgf0z,One time my ex told me I have ears like dumbo (they stick out a little bit but they're not that bad). Laughed it off but I haven't been able to get it out of my head since then. It's been over a year. Edit: Woah this blew up! Thanks for participating in the thread everyone!!!,When my nephew guessed my age was 36.  I was 24 at the time.,3640
dqzruj,Bottom Text,"Years ago I was eating at Taco Bell with a friend of mine. I got up to go to the bathroom mid meal. I knew something was off the moment I stepped into the room. A sixth sense if you will. But fuck, I had to pee. Now I tend to avoid urinals due to the splash back so I go to the first stall and push the door open. By the time the door swung open, hit the side wall and closed again I saw one of the most disgusting scenes I’ve ever experienced. You know how you can take a water hose and place your finger over the top to make the water spray? Well imagine that but with explosive diarrhea. The only logical thing I could think of was the poor soul who got so close to making it on time managed to pull their pants down just enough to make it spray. Because it’s been 18 years and I can remember that shit like it was yesterday. It was everywhere. The kind of everywhere that makes you think you’re on a prank show. I shit you not. I turned right around, pee all but forgotten, washed my hands -because just seeing that made me feel dirty- and turned to leave. On my way out I go to chuck the paper towel I used to dry my hands... and what do I see placed perfectly on top of the trash can? Dirty. Mother Fucking. Shit filled. Underwear. I went into that bathroom a boy. I came out a veteran with PTSD. So I did the only natural thing I could think of. Went back and told my friend he had to check out the stall in the men’s room. Because some burdens are too heavy to carry alone. We didn’t finish our food that day. Edit: spelling and structure.",10694
drdacf,Edit: Btw Gordon Ramsay never said that Edit2: Sab chutiya hai,"Another Ramsay quote: ""This salad has more olive oil on it than Popeye's cock"" Spat my dinner out when I heard that one.",5882
dshchc,"How do I, a nonathletic lifetime nerd, properly encourage the interests and activities of my son, who is more athletically inclined than I have ever been? He has already played little league soccer, flag football, and is arguably better at baseball than I am, and now he's excelling at basketball. I can't keep up with him - literally. He's fast, and has a natural talent that apparently skipped my generation. The closest I have come to playing sports was halftime on the football field in marching band. I barely know the rules to these games, and I could honestly find anything better to do than watch the college or professional versions with him.","You let him go on the teams, you let him choose his own path, you let him flourish, you buy him the shoes, the brands to fit in, you buy him the supplements and feed him the chicken breasts, chickpeas and lentils.  Like what you would do if he wanted to be an artist or a grease monkey, you let his interests lead the way, do what you can to study it up and fund him.  There's going to be friendships groups he'll assimilate into and help carry him along.",6690
dtvjqf,"We met in school, kept in touch on and off after because we went to different places. Got back in regular touch around 2 years ago, and now we meet regularly like twice a week starting a year ago. I have NEVER considered him someone I'd be interested in at all. But now I'm like ""???? Am i catching feels for this guy??"" Some back story: He's been there for me when I got my heart broken & betrayed by close friends. Just found out recently that he didn't like dessert but when I was sad as hell, he took me out for ice cream at B&J and listened to me pour my heart out. Even had drinks with me when I needed that kinda drowning. Once we were at my place with another friend and I was just lying on the couch while he spoke to that friend. I was sleepy but he was stroking my head/playing with my hair. I just had a finger snapping moment of ""oh crap, I think i caught some feels"" for him. When we hung out 1 on 1 few weeks ago, somehow things sort of connected in my head. All the times I put in effort for the wrong people and backfired on me, this guy was there to say no worries and it's making me question many things. edit: Girl OP! edit 2: I'm so overwhelmed by the response I've been getting here and feeling all nice and fuzzy reading all the successful stories. Thank you for sharing bits of your life, keep em coming! Edit 3 (Jan 2020): He asked me to be his girlfriend and I said yes! :)",Yup. That’s the best basis for a relationship.,3039
dusq6b,"EDIT: DAMN, I never imagined this would blow up. I'm gonna read everything and take in as much as I can. That should make me forget about the sadness for quite some time  Hope this post will help all the other sad ppl too. Thank you so much, boys!","I talk to myself in the mirror out loud sometimes. I ask myself why I’m feeling sad and then really try to answer. Then I try to explain it to myself, like what specific way I’m feeling and what might have caused me to feel like that. Sometimes it helps cause I realize that the reason I’m feeling sad is stupid or irrational. It helps to hear things out loud",6032
dxl4c8,"So I met this girl, she was beautiful. I was surprised to how well the convo went.  Constant eye contact and we spoke on the same subject matters. The first giveaway was that she mentioned breaking up with her girlfriend. And I thought “gf? Well girls these days refer to their friends as gf right?”. So keeping that little bit of hope, I continued the convo. And she was awesome.  When the bar started closing. My suspicions were confirmed. I asked for her number and she told me “um, Im gay”. Im like “oh, ok then.” I then just said “its cool, what’s your IG?:”  We exchanged and it was cool. We had a good convo, and no regrets. Well at-least one. Just the fact I could not be with someone as awesome as her.   But at the very least she can be a good wingman(wing woman?). *sigh Edit: Damn didn’t expect this thread to really blow up lol","One of my favorite ambulance partners was a lesbian, she was my first gay friend, and could pull chicks like a magnet, we had a riot together.",5333
e0mxc0,"I’m a 15M, sick right now, and just want my mom. My dad was arrested earlier this year for sexually and physically abusing me. I’m in foster care now and they are good foster parents but I just want my real mom. It doesn’t make sense. She died when I was 3 so I don’t even remember her, and all my life my dad told me she didn’t care about me. I miss her especially when I’m sick. I know it’s shameful at my age and I don’t actually need her to take care of me when I’m a 15 year old boy. But I still feel like I need her and don’t want to feel like this anymore.",there's nothing shameful about what you seek.,5464
e32493,"The conversation went like this; “Hey War_Messiah, are you actually watching what’s on TV?” “Nah I was just thinking about nothing” “What do you mean?” “What? You never thought about nothing before?” “No.. never” And since then they’ve made some comments (I think jokingly) about how I don’t think at all.","You were meditating. Being able to clear your mind and think of nothing is very difficult in meditation, they should try and do it.",7917
e3y86v,"Edit: Haha! Thanks for the stories everyone- it’s nice to know I’m not the only clueless one out there! For those asking the fight started when we were talking about whether or not to sign our kids up for another sport. I thought we’d figured it out, but apparently we had not come to a resolution. My wife was also stressed out preparing for an event she was leading that weekend so I thought I was just helping by giving her space! She read through this thread with me and thinks that I’m “a nerd for taking this to reddit.”","Freshman year in college, I found out halfway through the semester that I was dating a girl who lived down the hall. I found out when one of her friends went off on me for “cheating” on her by making out with a different girl at a party.  Apparently my “girlfriend” and I had sat next to each other for a while in the lounge earlier that semester and that meant we were boyfriend/girlfriend.",10477
e4hhqw,"My GF showed me a picture from her college track star days. Over the last few years we've, uh...grown...more in love, and before my brain could process an intelligent response, I just blurted out ""man you used to be so skinny"". ""Oh, ok"" as she walks away. WhathaveIdone.gif Airplanesweating.gif &#x200B; EDIT: A lot of y'all need to learn to communicate with those you love better. Love is patient, love is kind.   EDIT part deux: I've really enjoyed reading all of your responses while at work today.","We met in high school so I pretty much did anything I could to impress her. She said she didn’t like bananas so for almost 6 years I’ve pretended to despise bananas and have to turn in an Oscar worthy performance whenever I’m around her and we see one. I’m in too deep now, I have to eat them in secret. It’s a heavy burden.",11257
e4zlo2,"My kids have a board game with a chicken that squawks when you squish it.  I put it on the floor next to her bed so when she got up in the morning she would step on it.    It was glorious!  The next night I stayed up late playing some video games with a friend. I figured she had hidden the chicken somewhere, but I wasn't too concerned about it. Cue 4AM when I roll over and am greeting with a ""SQUAWK!"" I laughed so hard that I wasn't able to fall back asleep. I still chuckle just thinking about it.  &#x200B; What practical jokes have your significant others played on you? Edit: fixed spelling","i threw a glass of cold water at my girlfriend while she was showering. she screamed loud enough for the whole town to hear lmao.  she says she's going to get me back, but it's been over a year since then and i'm not sure how worried i should be.",3345
e6c6y0,"Yesterday, me (37/M) and my bandmates were changing in a gym locker room.  It was just us and a couple strangers.  We're all just bullshitting and having a good time when two little boys walk in to use the bathrooms.  They were in high spirits and sorta running and saying ""Hi! Hi! Hi! Hi!"" to all the grown men in the locker room as they ran past to go to the bathrooms.  We all smiled and said ""Hi!"" and waved back as they went by.   ....cute kids, ya know. A few minutes pass and they come back through running by saying ""Hi!  Hi!  Hi!"", like before.  We all smile like before but this time I drop some bass in my voice and just fuckin' around sorta shout, ""Settle Down Now"".  The sound resonated through the tile locker room and the boys immediately stopped, gave me this terrified look....like the fun was over, then they ran out of the room. One of the men I didn't know (guessing he was a dad) was just over smiling, laughing, and shaking his head, when I told my friends, wow, I never knew I had a Dad voice.    I had never activated it before. I felt like Paul Atreides becoming Muad'Dib.   ...I do feel bad for striking Dad fear into those cute little dudes, but I was just clowning around. &#x200B; Shout out to all dads out there who have to lay down some law with that booming dad voice.  I still remember the power it had over me as a kid and now, as a single dude with no kids and no nieces/nephews, it was interesting to discover I had the power.","I'm a mom and our 4 year old was acting out, my husband unleashed his dad voice. She dropped the attitude immediately and i damn near dropped my panties. It was hawt.",3400
e7e0wb,"I've been together for a long time, but recently single. Now I'm trying to date, downloaded this tinder app. Is this really what modern dating is? Edit: the better question is what's out there? Do people still try to meet women in person? Or is it all apps? I'm told it's just apps, but that can't be right",I know of 3 main ways. * The nightlife scene.  I've met a couple girlfriends at bars.  If you're a problem drinker this isn't the best approach.   * Through connections.  Your friend's girlfriend might have some single friends is one example.   * Dating apps.  Attractiveness and photo quality are big factors.,9448
e8cdwo,"I was reminiscing about past romantic playthroughs, as I usually do because playing IRL in single player mode tends to keep you stuck on certain levels, and realized I was a pretty shitty ass boyfriend to ""the one that got away"". What's worse is that I actually thought I was a good boyfriend because we just almost never fought about anything, so I took that as indicative of a healthy relationship. She was, however, one of the most patient angels I was unaware of having met.  One of the more memorable moments I'm hung up on that I look back on in disgust is this one time where she was driving to my house and her car broke down in the middle of the street late at night by the 7/11 that was a 5 minute walk from my house, or a 2 MINUTE DRIVE from my house. She called me with concern in her voice, almost trembling, saying she needed help pushing her car off the street. I told her to put it in neutral and push it to the side then to call a tow truck or something. I'm so ashamed to say that she complied with what I said in the sweetest and most understanding ""okay"" I've ever heard. The reason I didn't want to go and help was because I was fucking playing ranked Gears of War.....can you believe that shit? What's worse, is that I justified my decision by telling myself that she's a grown woman and should be able to handle it herself...man, if I could go back and kick my ass....Luckily some stranger was kind enough to help her get it off the street. She then proceeded to wait for both her dad and the tow truck all while she was texting me at home...2 minutes away. I've reflected and grown as a person since then, but man I still can't believe how shitty that was of me.","One of the things she told me after we broke up was that dating me felt more like being a mother than being a girlfriend, and I dwell on that a lot.",8661
eajcxk,"Edit: I really appreciate all of you sharing your stories and I am reading them one by one. My heart goes to all of you. Edit: My very first award! Thanks kind stranger. Tbh I never thought that this post would gather so much attention and I am overwhelmed with all  the comments and heartbreaking stories. Don't worry my fellow redditors, I am reading them one by one and replying to them as much as possible. Edit: Thank you the silver and gold! Please know I am still checking all of your stories and appreciate them so much.","When I graduated high school I was lucky to be able to take a trip to South Africa with friends. My grandmother was the main reason I was able to, paying for most of it as a graduation present. She was so excited to hear about it, see pictures, etc, but sadly she passed away halfway through the trip. On her deathbed she told my parents to keep everything a secret because she didn’t want to ruin the rest of the trip.  Didn’t get to go to the funeral. Edit: thank you all so much for your kind words!",7737
ecoalw,How does one politely say “please fuck me up” without being harsh? Edit: wow thanks you guys for so much great advice! I’m going to try my best to work though all the comments and inboxes you guys sent. I fell asleep and woke up with 400 so bear with me!,You already said it.,5293
edaofx,Could be the somewhat recent THICC trend.  Maybe it's the thigh gap.  Perhaps it is a strong headed personality.  What is something that other people tried to convince you is a thirst starter but you just couldn't agree?,OP's mom.  I just don't get it.,13787
